<?xml version="1.0" encoding="UTF-8"?>
<report xmlns:xsi="http://www.w3.org/2001/XMLSchema-instance"
        xsi:noNamespaceSchemaLocation="report.xsd"
        plan="Corridor house"
        rooms="11"
        connections="10"
        satisfied="11"
        broken="4"
        undetermined="3">
  <verdict rule="IRC-R302.5.1" severity="CODE" result="UNDETERMINED"/>
  <verdict rule="IRC-R311.1" severity="CODE" result="UNDETERMINED"/>
  <verdict rule="NYCBC-1210.4" severity="CODE" result="SATISFIED"/>
  <verdict rule="IRC-R302.5.1b" severity="CODE" result="UNDETERMINED"/>
  <verdict rule="BATH-DOOR" severity="PATTERN" result="SATISFIED"/>
  <verdict rule="PLAN-CONNECTED" severity="CODE" result="SATISFIED"/>
  <verdict rule="APL-127" severity="PATTERN" result="SATISFIED"/>
  <verdict rule="APL-130a" severity="PATTERN" result="SATISFIED"/>
  <verdict rule="APL-130b" severity="PATTERN" result="SATISFIED"/>
  <verdict rule="APL-129-exists" severity="PATTERN" result="SATISFIED"/>
  <verdict rule="APL-129-single" severity="ADVICE" result="SATISFIED"/>
  <verdict rule="APL-129-centroid" severity="ADVICE" result="SATISFIED"/>
  <verdict rule="APL-129-bypass" severity="PATTERN" result="BROKEN">
    <finding message="The shortest way from the entrance to 'Bedroom 1' never passes within a door of a common area - not counting a long passage, which does not put anybody in contact with the room it runs past. A common area that nobody passes will not be used.">
      <room ref="bed1"/>
    </finding>
    <finding message="The shortest way from the entrance to 'Bedroom 2' never passes within a door of a common area - not counting a long passage, which does not put anybody in contact with the room it runs past. A common area that nobody passes will not be used.">
      <room ref="bed2"/>
    </finding>
  </verdict>
  <verdict rule="APL-129-through" severity="ADVICE" result="SATISFIED"/>
  <verdict rule="APL-131a" severity="PATTERN" result="SATISFIED"/>
  <verdict rule="APL-131b" severity="PATTERN" result="BROKEN">
    <finding message="The public rooms form a tree, not a loop: there is no circuit one can walk around. Pattern 131 asks for the common rooms to be chained into a loop.">
      <room ref="foyer"/>
      <room ref="hall"/>
      <room ref="living"/>
      <room ref="dining"/>
      <room ref="kitchen"/>
      <room ref="stair"/>
    </finding>
  </verdict>
  <verdict rule="APL-132" severity="PATTERN" result="BROKEN">
    <finding message="'Hall' is longer than fifty feet, past the threshold at which a passage stops reading as a room.">
      <room ref="hall"/>
    </finding>
  </verdict>
  <verdict rule="APL-133" severity="PATTERN" result="BROKEN">
    <finding message="'Stair' does not adjoin a common room. A stair reached only through passages puts the upper floor behind a dead space.">
      <room ref="stair"/>
    </finding>
  </verdict>
</report>
